<!ELEMENT films (film*) >
<!ELEMENT film (title,categorie,dateSortie,cast)>
<!ATTLIST film ref CDATA #REQUIRED>
<!ELEMENT title (#PCDATA)>
<!ELEMENT categorie (#PCDATA)>
<!ELEMENT dateSortie (#PCDATA)>
<!ELEMENT cast (primary,secondary?)>
<!ELEMENT primary (#PCDATA)>
<!ELEMENT secondary (#PCDATA)>